{
  "formatVersion": 1,
  "synthetic": true,
  "cycleId": "cycle",
  "repositoryId": "fixture-repository",
  "featureId": "feature",
  "ticketId": "fixture-ticket",
  "runtimeId": "website-preview",
  "accountId": "cycle",
  "codeRevision": "fixture-code-v1",
  "configSha256": "14e6446dbb0dfa1fd5c9b94ac4620f4b1ad689b77346975c043301a839d8100a",
  "policyRevision": "fixture-policy-v1",
  "priceRevision": "fixture-price-v1",
  "observedAt": "2000-01-01T01:00:00Z",
  "sources": [
    {
      "id": "feature-context",
      "path": ".exphere/guides/feature.md",
      "repositoryId": "fixture-repository",
      "runtimeId": "website-preview",
      "revision": "fixture-content-v1",
      "sha256": "ab46360897c92fc922ce3c31350d4e553cbf5ce1d592a7262ada191dfb107ba8"
    }
  ],
  "graph": {
    "threadId": "fixture-thread",
    "checkpointRef": "not-persisted-fixture",
    "storeId": "graph-state",
    "driver": "unselected"
  },
  "state": {
    "workflowStage": "implementing",
    "ticketState": "in-progress",
    "runtimeState": "running",
    "financialState": "pending"
  }
}
